{
  "$schema": "../schema/release-manifest.schema.json",
  "version": 1,
  "status": "pre-activation",
  "release": "v0.1.0-rc.22",
  "source": {
    "repository": "https://github.com/AdverserialAI/attest-proxy",
    "commit": "3797387",
    "tag": "v0.1.0-rc.22"
  },
  "artifacts": [
    {
      "name": "attest-proxy",
      "image": "ghcr.io/adverserialai/attest-proxy@sha256:a76315b1e992127fa448a30eae3a4200660ba00cbe98a0280783431f54b5d4d5",
      "github_actions_run": "https://github.com/AdverserialAI/attest-proxy/actions/runs/38683133564",
      "provenance": "github-attestation",
      "sbom": "spdx"
    },
    {
      "name": "gpu-evidence-collector",
      "image": "ghcr.io/adverserialai/gpu-evidence-collector@sha256:3ce2230dd8d273777b770babe5e21594ab75d49ac02335ca06770194ededa6ab",
      "github_actions_run": "https://github.com/AdverserialAI/attest-proxy/actions/runs/38683133564",
      "provenance": "github-attestation",
      "sbom": "spdx"
    },
    {
      "name": "model-measurer",
      "image": "ghcr.io/adverserialai/model-measurer@sha256:5c409dcb1e68002a7c805ac572c1260e87718e635c3d6764cec19451eb712a58",
      "github_actions_run": "https://github.com/AdverserialAI/attest-proxy/actions/runs/38683133564",
      "provenance": "github-attestation",
      "sbom": "spdx"
    }
  ],
  "activation_missing": [
    "direct-signed count-only meter delivery is active; a separate mTLS ingress remains optional",
    "measured Intel TDX quote and event-log verification",
    "fresh NVIDIA GPU EAT evidence validated by an independent verifier",
    "canonical model artifact digest",
    "runtime and rendered compose digests",
    "attested cc-api TLS SPKI binding to the published receipt public key",
    "signed active policy"
  ]
}