{
  "$schema": "../schema/release-manifest.schema.json",
  "version": 1,
  "status": "pre-activation",
  "release": "v0.1.0-rc.9",
  "source": {
    "repository": "https://github.com/AdverserialAI/attest-proxy",
    "commit": "fce803fa1988bd6bcbe46e3ce82372015e444f9e",
    "tag": "v0.1.0-rc.9"
  },
  "artifacts": [
    {
      "name": "attest-proxy",
      "image": "ghcr.io/adverserialai/attest-proxy@sha256:f09b38d1d4f9c7cfc50dbe73aa956c445177d9960930ebfcb71c13065fd5fd2b",
      "github_actions_run": "https://github.com/AdverserialAI/attest-proxy/actions/runs/37261581702",
      "provenance": "github-attestation",
      "sbom": "spdx"
    },
    {
      "name": "gpu-evidence-collector",
      "image": "ghcr.io/adverserialai/gpu-evidence-collector@sha256:2ce83da72c7117a3b0723e0799a44930a0e0e9d3c77db1f2adca43910dffd6ad",
      "github_actions_run": "https://github.com/AdverserialAI/attest-proxy/actions/runs/37261581702",
      "provenance": "github-attestation",
      "sbom": "spdx"
    }
  ],
  "activation_missing": [
    "measured Intel TDX quote and event-log verification",
    "fresh NVIDIA GPU EAT evidence validated by an independent verifier",
    "canonical model artifact digest",
    "runtime and rendered compose digests",
    "attested cc-api TLS SPKI binding to the published receipt public key",
    "signed active policy"
  ]
}
